PID,Name,Title,PublicationType,ContentType,Language,Journal,JournalISSN,JournalEISSN,Status,Volume,Issue,HostPublication,StartPage,EndPage,Year,Edition,Pages,City,Publisher,Series,SeriesISSN,SeriesEISSN,ISBN,Urls,ISRN,DOI,ISI,PMID,ScopusId,NBN,LocalId,ArchiveNumber,Keywords,Categories,ResearchSubjects,Projects,Notes,Abstract,Opponents,Supervisors,Examiners,Patent,ThesisLevel,Credits,Programme,Subject,Uppsok,DefencePlace,DefenceLanguage,DefenceDate,CreatedDate,PublicationDate,LastUpdated,FullTextLink,Funder,NumberOfAuthors,ExternalCooperation,FridaLevel,PartOfThesis,PublicationSubtype,Conference,Term,ArticleId,Reviewed,FreeFulltext,SustainableDevelopment,Contributor
1184415,"Asnicar, Davide (University of Padova, Italy; University of Gothenburg, Sweden);Ašmonaitė, Giedrė (University of Gothenburg, Sweden);Birgersson, Lina (University of Gothenburg, Sweden);Kvarnemo, Charlotta (University of Gothenburg, Sweden);Svensson, Ola [shoasn17] [0000-0003-3752-3131] (Södertörns högskola [481], Institutionen för naturvetenskap, miljö och teknik [11831], Matematikens didaktik [15800]) (University of Gothenburg, Sweden);Sturve, Joachim (University of Gothenburg, Sweden)",Sand Goby : An Ecologically Relevant Species for Behavioural Ecotoxicology,Artikel i tidskrift,Refereegranskat,eng,Fishes,NA,2410-3888,published,3,1,NA,NA,NA,2018,NA,NA,NA,MDPI,NA,NA,NA,NA,http://www.mdpi.com/2410-3888/3/1/13,NA,10.3390/fishes3010013,NA,NA,2-s2.0-85075432188,urn:nbn:se:sh:diva-34656,NA,NA,locomotion; Gobiidae; fish larvae; behaviour; ecotoxicology,Biologiska vetenskaper (106),Environmental Studies,NA,<p>This article belongs to the Special Issue Aquatic Organisms for Environmental Monitoring</p>,"<p>Locomotion-based behavioural endpoints have been suggested as suitable sublethal endpoints for human and environmental hazard assessment, as well as for biomonitoring applications. Larval stages of the sand goby (Pomatoschistus minutus) possess a number of attractive qualities for experimental testing that make it a promising species in behavioural ecotoxicology. Here, we present a study aimed at developing a toolkit for using the sand goby as novel species for ecotoxicological studies and using locomotion as an alternative endpoint in toxicity testing. Exposure to three contaminants (copper (Cu), di-butyl phthalate (DBP) and perfluorooctanoic acid (PFOA) was tested in the early life stages of the sand goby and the locomotion patterns of the larvae were quantified using an automatic tracking system. In a photo-motor test, sand goby larvae displayed substantially higher activity in light than in dark cycles. Furthermore, all tested compounds exerted behavioural alterations, such as hypo- and hyperactivity. Our experimental results show that sand goby larvae produce robust and quantifiable locomotive responses, which could be used within an ecotoxicological context for assessing the behavioural toxicity of environmental pollutants, with particular relevance in the Nordic region. This study thus suggests that sand goby larvae have potential as an environmentally relevant species for behavioural ecotoxicology, and as such offer an alternative to standard model species.</p>",NA,NA,NA,NA,NA,NA,NA,NA,NA,NA,NA,NA,2018-02-21,2018-02-21,2020-03-30,http://sh.diva-portal.org/smash/get/diva2:1184415/FULLTEXT01.pdf,NA,6,NA,1,NA,NA,NA,NA,13,TRUE,TRUE,NA,NA
1146567,"Gunnarsson-Östling, Ulrika (KTH);Svenfelt, Åsa (KTH);Alfredsson, Eva (IVL);Aretun, Åsa (VTI);Bradley, Karin (KTH);Fauré, Eléonore (KTH);Fuehrer, Paul [shplfr14] [0000-0001-7019-8276] (Södertörns högskola [481], Institutionen för samhällsvetenskaper [11822], Sociologi [11841]);Hagbert, Pernilla (KTH);Isaksson, Karolina (IVL);Malmaéus, Mikael (IVL);Malmqvist, Tove (KTH);Buhr, Katarina (IVL);Finnveden, Göran (KTH);Francart, Nicolas (KTH);Hornborg, Alf (Lunds universitet);Stigson, Peter (IVL);Öhlund, Erika [sheaod12] [0000-0003-3230-6138] (Södertörns högskola [481], Institutionen för naturvetenskap, miljö och teknik [11831], Miljövetenskap [11837])",Scenarier för hållbart samhällsbyggande bortom BNP-tillväxt,Rapport,Övrigt vetenskapligt,swe,NA,NA,NA,NA,NA,NA,NA,NA,NA,2017,NA,23,Stockholm,NA,NA,NA,NA,978-91-7595-798-2,NA,NA,NA,NA,NA,NA,urn:nbn:se:sh:diva-33535,NA,NA,Scenarier;hållbar utveckling;välfärd;ekonomisk tillväxt,Tvärvetenskapliga studier inom samhällsvetenskap (50901),Environmental Studies,NA,NA,NA,NA,NA,NA,NA,NA,NA,NA,NA,NA,NA,NA,NA,2017-10-03,2017-10-03,2020-07-01,http://sh.diva-portal.org/smash/get/diva2:1146567/FULLTEXT01.pdf,Forskningsrådet Formas,17,NA,0,NA,NA,NA,NA,NA,TRUE,NA,NA,NA
1317210,"Svenfelt, Åsa (KTH);Alfredsson, Eva C. (KTH);Bradley, Karin (KTH);Fauré, Eléonore (KTH);Finnveden, Göran (KTH);Fuehrer, Paul [shplfr14] [0000-0001-7019-8276] (Södertörns högskola [481], Institutionen för samhällsvetenskaper [11822], Sociologi [11841]);Gunnarsson-Östling, Ulrika (KTH);Isaksson, Karolina (KTH / VTI);Malmaeus, Mikael (IVL );Malmqvist, Tove (KTH);Skånberg, Kristian (KTH);Stigsson, Peter (IVL);Aretun, Åsa (IVL);Buhr, Katarina (IVL);Hagbert, Pernilla (KTH);Öhlund, Erika [sheaod12] [0000-0003-3230-6138] (Södertörns högskola [481], Institutionen för naturvetenskap, miljö och teknik [11831], Miljövetenskap [11837]) (Södertörns högskola [481], Centrum för Östersjö- och Östeuropaforskning (CBEES) [496], Baltic & East European Graduate School (BEEGS) [483])",Scenarios for sustainable futures beyond GDP growth 2050,Artikel i tidskrift,Refereegranskat,eng,"Futures: The journal of policy, planning and futures studies",0016-3287,1873-6378,published,111,NA,NA,1,14,2019,NA,NA,NA,Elsevier,NA,NA,NA,NA,NA,NA,10.1016/j.futures.2019.05.001,000478703800001,NA,2-s2.0-85066049333,urn:nbn:se:sh:diva-38160,NA,NA,Multi-target;sustainability targets;backcasting;scenarios;beyond growth,Tvärvetenskapliga studier inom samhällsvetenskap (50901),NA,NA,NA,"<p>The idea of continued economic growth is increasingly questioned and critically analysed on the basis of its potential negative sustainability impact. Along with the critique, visions and strategies for alternative systems need also be brought onto the agenda. The aim of this paper is to present the qualitative content of scenarios that explore sustainability strategies for Swedish society when economic growth is not seen as an end in itself, and instead the objective is other values/targets that society might wish to achieve. Multi-target backcasting scenarios are developed that illustrate future states in which four sustainability targets (climate, land use, participation, and resource security) are to be attained. The focus of these four scenarios is: 1) a Collaborative economy, 2) Local self-sufficiency, 3) Automation for quality of life, and 4) Circular economy in the welfare state. In the paper, we also present the process of the development of the scenarios, and feedback from stakeholders. Although the focus is on Sweden, the process and scenarios may also be relevant for other similar countries. The scenarios are discussed in terms of their relevance and their purpose, the fulfilment of the sustainability targets, and the multi-target approach.</p>",NA,NA,NA,NA,NA,NA,NA,NA,NA,NA,NA,NA,2019-05-22,2019-05-22,2020-07-01,http://sh.diva-portal.org/smash/get/diva2:1317210/FULLTEXT02.pdf,Forskningsrådet Formas [259-2013-1842],16,NA,1,NA,NA,NA,NA,NA,TRUE,TRUE,NA,NA
1382026,"Tobieson, Ulrika [shuatn11] (Södertörns högskola [481], Lärarutbildningen [873601], Lärarutbildning och Estetiska lärprocesser [886703]);Mutvei, Ann [shanmz] (Södertörns högskola [481], Institutionen för naturvetenskap, miljö och teknik [11831], Matematikens didaktik [15800])",Science integrated with aesthetic expression for better understanding of science subject matter,Konferensbidrag,Refereegranskat,eng,NA,NA,NA,NA,NA,3,"Electronic Proceedings of the ESERA 2017 Conference : Research, practice and collaboration in science education",542,554,2019,NA,NA,"Dublin, Ireland",Dublin City University,NA,NA,NA,978-1-873769-84-3,https://www.esera.org/publications/esera-conference-proceedings/esera-2017,NA,NA,NA,NA,NA,urn:nbn:se:sh:diva-39680,NA,NA,aesthetic expression;integrating art with science;learning outcome,Didaktik (50302),NA,NA,NA,"<p>Teachers have to create a variation of learning situations to increase the understanding for theories andabstract models in science. We have experiences of combining aesthetic expression with science in pre-serviceteacher programme for more than ten years and have seen the benefits of embodying abstract theories withdance, art, music or drama and better understanding of science subject matter. The integration of science andaesthetic forms of expressions have support in the Swedish curriculum both for preschool and the compulsoryschool and it is therefore important to include exercises using aesthetic expression in the teacher educationprogram. The purpose of the workshop was to give examples of how art can be used to study phenomena inscience. The workshop was divided into three parts. In the first part the participants were doing differentexercises embodying concepts in physics and creating relations with each other. In the second part theparticipants in groups constructed a kinetic mobile. In the third part, the participants reflected and discussedtheir experience and understanding of phenomena during the workshop. Examples of assessments of theconstruction process were presented. Here we also present the planning and theoretical background to thework with aesthetic expression of science.</p>",NA,NA,NA,NA,NA,NA,NA,NA,NA,NA,NA,NA,2019-12-31,2019-12-31,2022-04-08,http://sh.diva-portal.org/smash/get/diva2:1382026/FULLTEXT01.pdf,NA,2,NA,0,NA,publishedPaper,"ESERA 2017 (European Science Education Research Association, Dublin, August 21-25, 2017.",NA,NA,TRUE,TRUE,NA,NA
1384579,"Amato, M;De Negri, E (University of Genoa, Genoa, Italy);Mattsson, Jan-Eric [sh99jcmn] (Södertörns högskola [481], Institutionen för naturvetenskap, miljö och teknik [11831]);Mutvei, Ann [shanmz] (Södertörns högskola [481], Institutionen för naturvetenskap, miljö och teknik [11831], Matematikens didaktik [15800]);Siri, Anna","Science, Technology, Engineering and Mathematics (STEM) Education in Europe","Kapitel i bok, del av antologi",Övrigt vetenskapligt,eng,NA,NA,NA,NA,NA,NA,Do Well Science : Manual for Innovative Pedagoy in STEM Contents : An Erasmus+ Project to increase secondary students’ achievements in Science subjects,10,14,2019,NA,NA,Breslavia,Società Dante Alighieri,NA,NA,NA,978-83-945213-0-1,https://www.dowellscience.eu/project//download/Templates%20and%20tools/Manuals/Manual_English_Version.pdf;https://www.dowellscience.eu/project/download/Templates%20and%20tools/Manuals/Manual%20Swedish%20version.pdf,NA,NA,NA,NA,NA,urn:nbn:se:sh:diva-39761,NA,NA,NA,Utbildningsvetenskap (503),Studies in the Educational Sciences,Do Well Science (Erasmus+ Project Number: 2017-1-IT02-KA201-036780),NA,NA,NA,NA,NA,NA,NA,NA,NA,NA,NA,NA,NA,NA,2020-01-10,2020-01-10,2020-01-10,http://sh.diva-portal.org/smash/get/diva2:1384579/FULLTEXT03.pdf;http://sh.diva-portal.org/smash/get/diva2:1384579/FULLTEXT04.pdf,"EU, Europeiska forskningsrådet [2017-1-IT02-KA201-036780]",5,NA,0,NA,NA,NA,NA,NA,TRUE,TRUE,NA,NA
1557931,"Pittman, S. J. (Univ Oxford, Sch Geog & Environm, Oxford Seascape Ecol Lab, Oxford OX1 3QY, England.;Project Seascape CIC, Plymouth PL2 1RP, Devon, England.);Yates, K. L. (Univ Salford, Sch Sci, Manchester M5 4WT, Lancs, England.);Bouchet, P. J. (Univ St Andrews, Sch Math & Stat, St Andrews KY16 9SS, KY, Scotland.;Univ St Andrews, Ctr Res Ecol & Environm Modelling, St Andrews KY16 9LZ, KY, Scotland.);Alvarez-Berastegui, D. (Balearic Isl Coastal Observing & Forecasting Syst, Palma De Mallorca 07121, Mallorca, Spain.);Andrefouet, S. (Univ Nouvelle Caledonie, Inst Rech Dev, Univ La Reunion, Ctr Natl Rech Sci,UMR 9220 ENTROPIE,IFREMER, Noumea, New Caledonia.);Bell, S. S. (Univ S Florida, Dept Integrat Biol, Florida, FL 33620 USA.);Berkström, C. (Swedish Univ Agr Sci, Inst Coastal Res, Dept Aquat Resources, Skolgatan 6, S-74242 Oregrund, Sweden.;Stockholm Univ, Dept Ecol Environm & Plant Sci DEEP, S-10691 Stockholm, Sweden.);Boström, C. (Abo Akad Univ, Environm & Marine Biol, Artillerigatan 6, Turku 20520, Finland.);Brown, C. J. (Dalhousie Univ, Dept Oceanog, Halifax, NS B3H 4R2, Canada.);Connolly, R. M. (Griffith Univ, Sch Environm & Sci, Australian Rivers Inst Coast & Estuaries, Queensland, Qld 4222, Australia.);Devillers, R. (Univ Montpellier, Univ Antilles, Univ Guyane, Univ Renion,Inst Rech Dev,UMR 228 ESPACE DEV,IRD, F-34393 Montpellier, France.);Eggleston, D. (North Carolina State Univ, Dept Marine Earth Atmospher Sci, Raleigh, NC 27695 USA.);Gilby, B. L. (Univ Sunshine Coast, Sch Sci & Engn, Maroochydore, Qld 4558, Australia.);Gullström, Martin [magx20] [0000-0002-7552-2431] (Södertörns högskola [481], Institutionen för naturvetenskap, miljö och teknik [11831], Miljövetenskap [11837]);Halpern, B. S. (Univ Calif Santa Barbara, Natl Ctr Ecol Anal & Synth, Santa Barbara, CA 93101 USA.;Univ Calif Santa Barbara, Bren Sch Environm Sci & Management, Santa Barbara, CA 93106 USA.);Hidalgo, M. (Ctr Oceanogrf Balears, Inst Espanol Oceanograf, Ecosyst Oceanog Grp GRECO, Palma De Mallorca 07015, Mallorca, Spain.);Holstein, D. (Louisiana State Univ, Dept Oceanog & Coastal Sci, Baton Rouge, LA 70803 USA.);Hovel, K. (San Diego State Univ, Coastal & Marine Inst, Dept Biol, San Diego, CA 92101 USA.);Huettmann, F. (Univ Alaska Fairbanks, Inst Arctic Biol, Biol & Wildlife Dept, EWHALE Lab, Fairbanks, AK 99775 USA.);Jackson, E. L. (Cent Queensland Univ, Coastal Marine Ecosyst Res Ctr, Gladstone, Qld 4680, Australia.);James, W. R. (Univ Louisiana, Dept Biol, Lafayette, LA 70504 USA.);Kellner, J. B. (Int Council Explorat Sea ICES, DK-1553 Copenhagen V, Denmark.);Kot, C. Y. (Duke Univ, Nicholas Sch Environm, Marine Geospatial Ecol Lab, Beaufort, NC 28516 USA.);Lecours, V (Univ Florida, Sch Forest Resources & Conservat, Geomat Program & Fisheries & Aquat Sci Program, Florida, FL 32611 USA.);Lepczyk, C. (Auburn Univ, Sch Forestry & Wildlife Sci, Auburn, AL 36849 USA.);Nagelkerken, I (Univ Adelaide, Sch Biol Sci, Southern Seas Ecol Labs, South Australia, SA 5005, Australia.;Univ Adelaide, Environm Inst, Southern Seas Ecol Labs, South Australia, SA 5005, Australia.);Nelson, J. (Louisiana State Univ, Dept Oceanog & Coastal Sci, Baton Rouge, LA 70803 USA.);Olds, A. D. (Univ Sunshine Coast, Sch Sci & Engn, Maroochydore, Qld 4558, Australia.);Santos, R. O. (Florida Int Univ, Inst Environm, Miami, FL 33199 USA.);Scales, K. L. (Univ Sunshine Coast, Sch Sci & Engn, Maroochydore, Qld 4558, Australia.);Schneider, D. C. (Mem Univ Newfoundland, Dept Ocean Sci, Newfoundland, NF A1B 3X7, Canada.);Schilling, H. T. (Univ New South Wales, Sch Biol Earth Environm Sci, Sydney, NSW, Australia.;Sydney Inst Marine Sci, Mosman, NSW 2088, Australia.);Simenstad, C. (Univ Washington, Sch Aquat & Fishery Sci, Seattle, WA 98195 USA.);Suthers, I. M. (Univ New South Wales, Sch Biol Earth Environm Sci, Sydney, NSW, Australia.;Sydney Inst Marine Sci, Mosman, NSW 2088, Australia.);Treml, E. A. (Deakin Univ, Ctr Integrat Ecol, Sch Life & Environm Sci, Victoria, Vic 3216, Australia.);Wedding, L. M. (Univ Oxford, Sch Geog & Environm, Oxford Seascape Ecol Lab, Oxford OX1 3QY, England.);Yates, P. (Sydney Inst Marine Sci, Mosman, NSW 2088, Australia.;Dept Agr Water & Environm, Marine & Freshwater Species Conservat Biodivers C, Canberra, ACT 2601, Australia.);Young, M. (Deakin Univ, Ctr Integrat Ecol, Sch Life & Environm Sci, Victoria, Vic 3216, Australia.)",Seascape ecology : identifying research priorities for an emerging ocean sustainability science,Artikel i tidskrift,Refereegranskat,eng,Marine Ecology Progress Series,0171-8630,1616-1599,published,663,NA,NA,1,29,2021,NA,NA,NA,INTER-RESEARCH,NA,NA,NA,NA,NA,NA,10.3354/meps13661,000644439200001,NA,NA,urn:nbn:se:sh:diva-45450,NA,NA,Research priorities;Ecosystem-based management;Sustainability science;Connectivity;Restoration;Spatial patterns,Ekologi (10611),NA,NA,NA,"<p>Seascape ecology, the marine-centric counterpart to landscape ecology, is rapidly emerging as an interdisciplinary and spatially explicit ecological science with relevance to marine management, bio-diversity conservation, and restoration. While important progress in this field has been made in the past decade, there has been no coherent prioritisation of key research questions to help set the future research agenda for seascape ecology. We used a 2-stage modified Delphi method to solicit applied research questions from academic experts in seascape ecology and then asked respondents to identify priority questions across 9 interrelated research themes using 2 rounds of selection. We also invited senior management/conservation practitioners to prioritise the same research questions. Analyses highlighted congruence and discrepancies in perceived priorities for applied research. Themes related to both ecological concepts and management practice, and those identified as priorities include seascape change, seascape connectivity, spatial and temporal scale, ecosystem-based management, and emerging technologies and metrics. Highest-priority questions (upper tercile) received 50% agreement between respondent groups, and lowest priorities (lower tercile) received 58% agreement. Across all 3 priority tiers, 36 of the 55 questions were within a +/- 10% band of agreement. We present the most important applied research questions as determined by the proportion of votes received. For each theme, we provide a synthesis of the research challenges and the potential role of seascape ecology. These priority questions and themes serve as a roadmap for advancing applied seascape ecology during, and beyond, the UN Decade of Ocean Science for Sustainable Development (2021-2030).</p>",NA,NA,NA,NA,NA,NA,NA,NA,NA,NA,NA,NA,2021-05-27,2021-05-27,2021-05-27,NA,NA,38,NA,2,NA,NA,NA,NA,NA,TRUE,TRUE,NA,NA
1084273,"van Helmond, Niels A.G.M. (Utrecht University, Utrecht, Netherlands);Quintana Krupinski, Nadine B. (Lund University);Lougheed, Bryan C. (Uppsala University);Obrochta, Stephen P. (Akita University, Akita, Japan);Andrén, Thomas [shtsan06] [0000-0001-5615-6088] (Södertörns högskola [481], Institutionen för naturvetenskap, miljö och teknik [11831], Miljövetenskap [11837]);Slomp, Caroline P. (Utrecht University, Utrecht, Netherlands)","Seasonal hypoxia was a natural feature of the coastal zone in the Little Belt, Denmark, during the past 8 ka",Artikel i tidskrift,Refereegranskat,eng,Marine Geology,0025-3227,1872-6151,published,387,NA,NA,45,57,2017,NA,NA,NA,Elsevier,NA,NA,NA,NA,NA,NA,10.1016/j.margeo.2017.03.008,000403526400004,NA,2-s2.0-85016412063,urn:nbn:se:sh:diva-32309,NA,NA,NA,Miljövetenskap (10502),Baltic and East European studies,NA,NA,"<p>The extent of the hypoxic area in the Baltic Sea has rapidly expanded over the past century. Two previous phases of widespread hypoxia, coinciding with the Holocene Thermal Maximum (HTM; 8–4 ka before present; BP) and the Medieval Climate Anomaly (MCA; 2–0.8 ka BP), have been identified. Relatively little is known about bottom water redox conditions in the coastal zone of the Baltic Sea during the Holocene, however. Here we studied the geochemical composition of a sediment sequence from a currently seasonally hypoxic site in the Danish coastal zone, the Little Belt, retrieved during Integrated Ocean Drilling Program Expedition 347 (Site M0059). The base of the studied sediment sequence consists of clays low in organic carbon (Corg), molybdenum (Mo) and iron sulfides (Fe-sulfides), and rich in iron oxides (Fe-oxides), indicative of a well-oxygenated, oligotrophic (glacial) meltwater lake. An erosional unconformity separates the glacial lake sediments from sediments that are rich in Corg. The absence of Mo, in combination with high Corg/S values, indicates that these sediments were deposited in a highly productive, well-oxygenated freshwater lake. The transition to modern brackish/marine conditions was very rapid, and subsequent continuous sequestration of Mo in the sediment and high ratios of reactive iron (FeHR) over total Fe (FeTOT) suggest (seasonal) hypoxia occurred over the last ~ 8 ka. Maxima in sediment Corg, Mo and FeHR/FeTOT ratios during the HTM and MCA suggest that the hypoxia intensified. Our results demonstrate that the Little Belt is naturally susceptible to the development of seasonal hypoxia. While periods of climatic warming led to increased deoxygenation of bottom waters, high nutrient availability in combination with density stratification were likely the main drivers of hypoxia in this part of the coastal zone of the Baltic Sea during the Holocene.</p>",NA,NA,NA,NA,NA,NA,NA,NA,NA,NA,NA,NA,2017-03-24,2017-03-24,2022-03-02,NA,Östersjöstiftelsen [75/2014],6,NA,1,NA,NA,NA,NA,NA,TRUE,NA,NA,NA
1222517,"Plue, Jan [shjnpe14] [0000-0002-6999-669X] (Södertörns högskola [481], Institutionen för naturvetenskap, miljö och teknik [11831], Miljövetenskap [11837]) (Stockholm University);Cousins, S. A. O. (Stockholm University)",Seed dispersal in both space and time is necessary for plant diversity maintenance in fragmented landscapes,Artikel i tidskrift,Refereegranskat,eng,Oikos,0030-1299,1600-0706,published,127,6,NA,780,791,2018,NA,NA,NA,Wiley-Blackwell,NA,NA,NA,NA,NA,NA,10.1111/oik.04813,000434153600003,NA,2-s2.0-85048053838,urn:nbn:se:sh:diva-35685,NA,NA,NA,Geovetenskap och miljövetenskap (105),NA,NA,NA,"<p>Metacommunity theory emphasizes that seed dispersal not only limits but equally maintains plant diversity, though the latter receives little empirical attention. Discerning the temporal and spatial components of seed dispersal and understanding how their interaction shapes fragmented communities and maintains their diversity may be pivotal to further our ecological understanding of spatial and temporal seed dispersal and its implications for landscape-scale conservation management. To investigate the relative importance of spatial and temporal seed dispersal and their roles in maintaining plant diversity, the herb layer and seed bank of grassland communities were inventoried in 77 sites across abandoned and intact rotational grazing networks in a 100 km2 fragmented grassland landscape in the Stockholm archipelago (Baltic Sea, Sweden). Besides analysing alpha- and beta-diversity patterns, nestedness analyses connect deterministic community changes and diversity losses with dispersal-related life-history traits and habitat specialization to identify the mechanism driving community changes and maintaining local diversity. The loss of rotational grazing networks caused community diversity declines via non-random extinctions of spatially and temporally poor dispersers, particularly among grassland specialists. Temporal seed dispersal halted further community disassembly, maintaining diversity in the abandoned grazing networks. Spatial dispersal within the intact grazing networks was found to be an overriding, homogenizing agent conserving diversity in both the herb layer and seed bank. This empirical evidence establishes how spatial and temporal seed dispersal interact to maintain diversity in fragmented landscapes. Poorly connected grasslands appear limited by spatial dispersal, yet are maintained by temporal seed dispersal. In fragmented landscapes where grazing networks are rarely present, temporal rather than spatial seed dispersal may be more important in maintaining species diversity, since effective spatial dispersal may be significantly diminished. The grazing network's efficacy at boosting spatial dispersal and upholding community diversity presents a powerful management tool to conserve local and regional species diversity. © 2017 The Authors</p>",NA,NA,NA,NA,NA,NA,NA,NA,NA,NA,NA,NA,2018-06-21,2018-06-21,2020-04-06,NA,Östersjöstiftelsen,2,NA,1,NA,NA,NA,NA,NA,TRUE,NA,NA,NA
